{
  "accuracy": 0.9134,
  "brier": 0.1618,
  "class_distribution": {
    "formation.context_sufficient.v2:false": 0.023540489642184557,
    "formation.context_sufficient.v2:true": 0.4472693032015066,
    "formation.future_utility.v2:2": 0.007532956685499058,
    "formation.future_utility.v2:3": 0.015065913370998116,
    "formation.future_utility.v2:4": 0.004708097928436911,
    "formation.is_durable.v2:false": 0.4199623352165725,
    "formation.is_durable.v2:true": 0.027306967984934087,
    "formation.memory_class.v2:commitment": 0.0009416195856873823,
    "formation.memory_class.v2:durable_fact": 0.00847457627118644,
    "formation.memory_class.v2:preference": 0.01224105461393597,
    "formation.memory_class.v2:procedure": 0.002824858757062147,
    "formation.memory_class.v2:relationship": 0.0009416195856873823,
    "formation.memory_class.v2:sensitive": 0.0018832391713747645,
    "formation.operation.v2:STORE_NEW": 0.022598870056497175,
    "formation.operation.v2:SUPERSEDE_EXISTING": 0.0009416195856873823,
    "formation.operation.v2:UPDATE_EXISTING": 0.003766478342749529
  },
  "collapse": {
    "class_prior_l1": 0.11487758945386059,
    "collapsed": false,
    "expected_distribution": {
      "formation.context_sufficient.v2:false": 0.023540489642184557,
      "formation.context_sufficient.v2:true": 0.4472693032015066,
      "formation.future_utility.v2:2": 0.007532956685499058,
      "formation.future_utility.v2:3": 0.015065913370998116,
      "formation.future_utility.v2:4": 0.004708097928436911,
      "formation.is_durable.v2:false": 0.4199623352165725,
      "formation.is_durable.v2:true": 0.027306967984934087,
      "formation.memory_class.v2:commitment": 0.0009416195856873823,
      "formation.memory_class.v2:durable_fact": 0.00847457627118644,
      "formation.memory_class.v2:preference": 0.01224105461393597,
      "formation.memory_class.v2:procedure": 0.002824858757062147,
      "formation.memory_class.v2:relationship": 0.0009416195856873823,
      "formation.memory_class.v2:sensitive": 0.0018832391713747645,
      "formation.operation.v2:STORE_NEW": 0.022598870056497175,
      "formation.operation.v2:SUPERSEDE_EXISTING": 0.0009416195856873823,
      "formation.operation.v2:UPDATE_EXISTING": 0.003766478342749529
    },
    "laya_stats": {
      "mean_ce": 0.7420643356070387,
      "mean_ln_k": 0.7892398661552537,
      "mean_logit_range": 12.969538557674673,
      "n": 1062.0
    },
    "laya_warning": null,
    "maximum_predicted_class_share": 0.467984934086629,
    "missing_expected_classes": [
      "formation.memory_class.v2:commitment",
      "formation.memory_class.v2:procedure",
      "formation.memory_class.v2:relationship",
      "formation.memory_class.v2:sensitive",
      "formation.operation.v2:SUPERSEDE_EXISTING"
    ],
    "predicted_distribution": {
      "formation.context_sufficient.v2:false": 0.002824858757062147,
      "formation.context_sufficient.v2:true": 0.467984934086629,
      "formation.future_utility.v2:2": 0.005649717514124294,
      "formation.future_utility.v2:3": 0.018832391713747645,
      "formation.future_utility.v2:4": 0.002824858757062147,
      "formation.is_durable.v2:false": 0.4444444444444444,
      "formation.is_durable.v2:true": 0.002824858757062147,
      "formation.memory_class.v2:durable_fact": 0.009416195856873822,
      "formation.memory_class.v2:preference": 0.017890772128060263,
      "formation.operation.v2:DO_NOT_STORE": 0.0009416195856873823,
      "formation.operation.v2:DUPLICATE": 0.0009416195856873823,
      "formation.operation.v2:STORE_NEW": 0.02071563088512241,
      "formation.operation.v2:UPDATE_EXISTING": 0.004708097928436911
    }
  },
  "ece": 0.079,
  "format": "atmem-laya-metric-report-v1",
  "loss_history": [
    0.5215392731166077,
    0.05274760864994642,
    0.009078987927090556,
    0.0011128575854382073
  ],
  "macro_f1": 0.31164240701538437,
  "nll": 0.7421,
  "nonfinite": false,
  "objective": "soft-ce",
  "run_id": "soft-ce-410239-20261013T112557Z",
  "split": "validation",
  "truncation": {
    "items": 1062,
    "truncated_example_ids": [
      "transition_04ce41d4c5032d477a76f70e:formation.context_sufficient.v2",
      "transition_04ce41d4c5032d477a76f70e:formation.is_durable.v2",
      "transition_135b9d5a1517bdaf085b92bb:formation.context_sufficient.v2",
      "transition_135b9d5a1517bdaf085b92bb:formation.is_durable.v2",
      "transition_135df97ee3d4c7f1fd509d20:formation.context_sufficient.v2",
      "transition_135df97ee3d4c7f1fd509d20:formation.is_durable.v2",
      "transition_1478e22be967b02a073d9428:formation.context_sufficient.v2",
      "transition_1478e22be967b02a073d9428:formation.is_durable.v2",
      "transition_1e10d830a9048b1fba6190a5:formation.context_sufficient.v2",
      "transition_1e10d830a9048b1fba6190a5:formation.is_durable.v2",
      "transition_1fc1934e045ddc433bbff771:formation.context_sufficient.v2",
      "transition_1fc1934e045ddc433bbff771:formation.is_durable.v2",
      "transition_2329c3974764eca23dc5e591:formation.context_sufficient.v2",
      "transition_2329c3974764eca23dc5e591:formation.is_durable.v2",
      "transition_25e3d879d47d87157fccf026:formation.context_sufficient.v2",
      "transition_25e3d879d47d87157fccf026:formation.is_durable.v2",
      "transition_2941d3c1f9339fc66015bee1:formation.context_sufficient.v2",
      "transition_2941d3c1f9339fc66015bee1:formation.is_durable.v2",
      "transition_2a55c281215d317a92f8e3cf:formation.context_sufficient.v2",
      "transition_2a55c281215d317a92f8e3cf:formation.is_durable.v2",
      "transition_2dd9d78324c908f46e3778b3:formation.context_sufficient.v2",
      "transition_2dd9d78324c908f46e3778b3:formation.is_durable.v2",
      "transition_2fd74049f766b9050776dcc7:formation.context_sufficient.v2",
      "transition_2fd74049f766b9050776dcc7:formation.is_durable.v2",
      "transition_3a983677e0f5c5e033b19bb0:formation.context_sufficient.v2",
      "transition_3a983677e0f5c5e033b19bb0:formation.is_durable.v2",
      "transition_3aab7d2e7908cb3b88de05e5:formation.context_sufficient.v2",
      "transition_3aab7d2e7908cb3b88de05e5:formation.is_durable.v2",
      "transition_3ba8d7a3ed6e837668d72de0:formation.context_sufficient.v2",
      "transition_3ba8d7a3ed6e837668d72de0:formation.is_durable.v2",
      "transition_3babbeb6c61b1e19e69a3ed5:formation.context_sufficient.v2",
      "transition_3babbeb6c61b1e19e69a3ed5:formation.is_durable.v2",
      "transition_3babbeb6c61b1e19e69a3ed5:formation.memory_class.v2",
      "transition_3babbeb6c61b1e19e69a3ed5:formation.operation.v2",
      "transition_3babbeb6c61b1e19e69a3ed5:formation.future_utility.v2",
      "transition_4506393ced7ad5114f6cf9f8:formation.context_sufficient.v2",
      "transition_4506393ced7ad5114f6cf9f8:formation.is_durable.v2",
      "transition_4b502cbff26b3d97a7ae5247:formation.context_sufficient.v2",
      "transition_4b502cbff26b3d97a7ae5247:formation.is_durable.v2",
      "transition_4b502cbff26b3d97a7ae5247:formation.memory_class.v2",
      "transition_4b502cbff26b3d97a7ae5247:formation.operation.v2",
      "transition_4b502cbff26b3d97a7ae5247:formation.future_utility.v2",
      "transition_500ecd49014a218e11206809:formation.context_sufficient.v2",
      "transition_500ecd49014a218e11206809:formation.is_durable.v2",
      "transition_513d820421d7513a41d004e6:formation.context_sufficient.v2",
      "transition_513d820421d7513a41d004e6:formation.is_durable.v2",
      "transition_5b87d55ced1777fc68e77574:formation.context_sufficient.v2",
      "transition_5b87d55ced1777fc68e77574:formation.is_durable.v2",
      "transition_5e05a9ee3d10ed79bb850f55:formation.context_sufficient.v2",
      "transition_5e05a9ee3d10ed79bb850f55:formation.is_durable.v2",
      "transition_721d68fa6e9fe057e8ed2537:formation.context_sufficient.v2",
      "transition_721d68fa6e9fe057e8ed2537:formation.is_durable.v2",
      "transition_76b9380bce15da79a106861d:formation.context_sufficient.v2",
      "transition_76b9380bce15da79a106861d:formation.is_durable.v2",
      "transition_7e6517daebb3ad92f08fd469:formation.context_sufficient.v2",
      "transition_7e6517daebb3ad92f08fd469:formation.is_durable.v2",
      "transition_7e6517daebb3ad92f08fd469:formation.memory_class.v2",
      "transition_7e6517daebb3ad92f08fd469:formation.operation.v2",
      "transition_7e6517daebb3ad92f08fd469:formation.future_utility.v2",
      "transition_80bf8c3aac2ba20b38e0707b:formation.context_sufficient.v2",
      "transition_80bf8c3aac2ba20b38e0707b:formation.is_durable.v2",
      "transition_96048188ef58f5c71065037f:formation.context_sufficient.v2",
      "transition_96048188ef58f5c71065037f:formation.is_durable.v2",
      "transition_9d030a6eb5382ea9ffc1e82c:formation.context_sufficient.v2",
      "transition_9d030a6eb5382ea9ffc1e82c:formation.is_durable.v2",
      "transition_9f0b1f0a87fcdc9f6a52f30f:formation.context_sufficient.v2",
      "transition_9f0b1f0a87fcdc9f6a52f30f:formation.is_durable.v2",
      "transition_a35bd27ae1020fa2a39b471c:formation.context_sufficient.v2",
      "transition_a35bd27ae1020fa2a39b471c:formation.is_durable.v2",
      "transition_a35bd27ae1020fa2a39b471c:formation.memory_class.v2",
      "transition_a35bd27ae1020fa2a39b471c:formation.operation.v2",
      "transition_a35bd27ae1020fa2a39b471c:formation.future_utility.v2",
      "transition_b9668fb075b2902b59a65e86:formation.context_sufficient.v2",
      "transition_b9668fb075b2902b59a65e86:formation.is_durable.v2",
      "transition_bef62f7d4658983dc5132366:formation.context_sufficient.v2",
      "transition_bef62f7d4658983dc5132366:formation.is_durable.v2",
      "transition_bf9f36796a1c0a8e1daedb79:formation.context_sufficient.v2",
      "transition_bf9f36796a1c0a8e1daedb79:formation.is_durable.v2",
      "transition_c72168b66c1ee08aea2c35d3:formation.context_sufficient.v2",
      "transition_c72168b66c1ee08aea2c35d3:formation.is_durable.v2",
      "transition_c7a02fffa072cc06572b3d17:formation.context_sufficient.v2",